"Order-level classifier (refinement & calibration) and size estimation (exposing size in the UI, add centimeter calibration, actually incorporating size into models).",Francis  Michael meeting notes,3,,,,,,,,,,,,Feature/ML/UI,,,,,,,,"Order-level classifier (refinement & calibration) and size estimation (exposing size in the UI, add centimeter calibration, actually incorporating size into models).","Francis / Michael Meeting Notes (Jan 21, UC-Davis, Planning Topics)",,,,,
"Labs page - Inference app, butterfly experiment.",Francis  Michael meeting notes,4,,,,,,,,,,,,Feature/UI,,,,,,,,"Labs page - Inference app, butterfly experiment.","Francis / Michael Meeting Notes (Jan 21, Planning Topics)",,,,,
Stability issues on the platform.,Francis  Michael meeting notes,5,,,,,,,,,,,,Bug/Issue,,,,,,,,Stability issues on the platform.,"Francis / Michael Meeting Notes (Feb 19, 2025)",,,,,
Species page functionality/improvement.,Francis  Michael meeting notes,6,,,,,,,,,,,,Feature/UI,,,,,,,,Species page functionality/improvement.,"Francis / Michael Meeting Notes (Feb 19, 2025)",,,,,
"Dedicated interface for testing models (e.g., using Streamlit or Solara).",Francis  Michael meeting notes,7,,,,,,,,,,,,Feature/ML Dev Tool,,,,,,,,"Dedicated interface for testing models (e.g., using Streamlit or Solara).","Francis / Michael Meeting Notes (Jun 4, 2025)",,,,,
"Python & R clients to interact with data already in Antenna (e.g., for deleting small/blurry occurrences, or flagging occurrences by probability).",Francis  Michael meeting notes,8,,,,,,,,,,,,Feature/API,,,,,,,,"Python & R clients to interact with data already in Antenna (e.g., for deleting small/blurry occurrences, or flagging occurrences by probability).","Francis / Michael Meeting Notes (Jun 4, 2025)",,,,,
Abstracting our object store and allowing more uploading from the UI and a Desktop client for uploading.,Francis  Michael meeting notes,9,,,,,,,,,,,,Feature/Upload,,,,,,,,Abstracting our object store and allowing more uploading from the UI and a Desktop client for uploading.,"Francis / Michael Meeting Notes (Jun 18, 2025, Priorities for data uploading)",,,,,
Scratch/draft project based on images (upload a folder).,Francis  Michael meeting notes,10,,,,,,,,,,,,Feature/Upload,,,,,,,,Scratch/draft project based on images (upload a folder).,"Francis / Michael Meeting Notes (Jun 18, 2025)",,,,,
"Features for data analysis: Flight charts (per species & per taxa list), Maps with data, Infer absence (show species not seen), Clear indication of which months/days were not captured/processed at all.",Francis  Michael meeting notes,11,,,,,,,,,,,,Feature/UI/ML,,,,,,,,"Features for data analysis: Flight charts (per species & per taxa list), Maps with data, Infer absence (show species not seen), Clear indication of which months/days were not captured/processed at all.","Francis / Michael Meeting Notes (Jun 18, 2025)",,,,,
DB partitioning exploration and implementation.,Francis  Michael meeting notes,12,,,,,,,,,,,,Tech Debt/Feature,,,,,,,,DB partitioning exploration and implementation.,"Francis / Michael Meeting Notes (Jul 24, 2025, Dev tasks for Francis)",,,,,
"Distributed data processing (hosting & serving models with multiple workers, making it easier for researchers to host & test models, evaluating tools like Airflow or Weaver).",Francis  Michael meeting notes,13,,,,,,,,,,,,Feature/Infrastructure,,,,,,,,"Distributed data processing (hosting & serving models with multiple workers, making it easier for researchers to host & test models, evaluating tools like Airflow or Weaver).","Francis / Michael Meeting Notes (Jul 24, 2025, VISS application)",,,,,
Switch to a JS framework in 2026.,Francis  Michael meeting notes,14,,,,,,,,,,,,Tech Debt,,,,,,,,Switch to a JS framework in 2026.,"Francis / Michael Meeting Notes (Aug 27, 2025)",,,,,
Circle back to OpenAPI docs to allow researchers to query occurrences in R (using an auto-generated client).,Francis  Michael meeting notes,15,,,,,,,,,,,,Feature/API/Documentation,,,,,,,,Circle back to OpenAPI docs to allow researchers to query occurrences in R (using an auto-generated client).,"Francis / Michael Meeting Notes (Aug 27, 2025)",,,,,
"Generalized pipeline: General insect detector (any background) & Global moth classifier (e.g., using OWLv2).",Francis  Michael meeting notes,16,,,,,,,,,,,,Feature/ML,,,,,,,,"Generalized pipeline: General insect detector (any background) & Global moth classifier (e.g., using OWLv2).","Francis / Michael Meeting Notes (Oct 15, 2025); Antenna gaps - big picture",,,,,
Mandatory Decision: Direction of platform (Client portals + self-install vs. Central platform/fully self-service vs. Open-source only).,Francis  Michael meeting notes,17,,,,,,,,,,,,Strategy/Goal,,,,,,,,Mandatory Decision: Direction of platform (Client portals + self-install vs. Central platform/fully self-service vs. Open-source only).,"Francis / Michael Meeting Notes (Dec 17, 2025)",,,,,
Allow more CEPHFS shares.,Francis  Michael meeting notes,18,,,,,,,,,,,,Infrastructure/Resource,,,,,,,,Allow more CEPHFS shares.,Francis / Michael Meeting Notes (Jan 21),,,,,
Processing stability/stabilization.,Francis  Michael meeting notes,19,,,,,,,,,,,,Bug/Issue,,,,,,,,Processing stability/stabilization.,Antenna gaps - big picture,,,,,
"Reworking collections (clarifying dynamic filters vs. fixed datasets, predefined collections/dynamic presets).",Francis  Michael meeting notes,20,,,,,,,,,,,,Feature/Data Mgmt,,,,,,,,"Reworking collections (clarifying dynamic filters vs. fixed datasets, predefined collections/dynamic presets).",Antenna gaps - big picture,,,,,
"Processing convenience (buttons for process this night, process this collection).",Francis  Michael meeting notes,21,,,,,,,,,,,,Feature/UI,,,,,,,,"Processing convenience (buttons for process this night, process this collection).",Antenna gaps - big picture,,,,,
"Post processing functions – “special sauce” (small, blurry, tracking sequential detections).",Francis  Michael meeting notes,22,,,,,,,,,,,,Feature/ML,,,,,,,,"Post processing functions – “special sauce” (small, blurry, tracking sequential detections).",Antenna gaps - big picture,,,,,
Showing some evaluation & statistics within the UI.,Francis  Michael meeting notes,23,,,,,,,,,,,,Feature/UI/Analytics,,,,,,,,Showing some evaluation & statistics within the UI.,Antenna gaps - big picture,,,,,
"Tracking Progress: Knowing what’s been processed/verified (e.g., a progress bar).",Francis  Michael meeting notes,24,,,,,,,,,,,,Feature/UI/Status,,,,,,,,"Tracking Progress: Knowing what’s been processed/verified (e.g., a progress bar).",Antenna gaps - big picture,,,,,
"Taxonomy management (External sources, managing taxa/lists/synonyms, mapping to algorithms, bulk import to assign to lists).",Francis  Michael meeting notes,25,,,,,,,,,,,,Feature/Data Mgmt/UI,,,,,,,,"Taxonomy management (External sources, managing taxa/lists/synonyms, mapping to algorithms, bulk import to assign to lists).",Antenna gaps - big picture,,,,,
Darwincore export and Export format for ML retraining.,Francis  Michael meeting notes,26,,,,,,,,,,,,Feature/Export,,,,,,,,Darwincore export and Export format for ML retraining.,Antenna gaps - big picture,,,,,
"Research/Document plan for easier data import from cameras/SD cards (Desktop app, CLI scripts) to reduce mistakes.",Francis  Michael meeting notes,27,,,,,,,,,,,,Feature/Upload,,,,,,,,"Research/Document plan for easier data import from cameras/SD cards (Desktop app, CLI scripts) to reduce mistakes.",Antenna gaps - big picture,,,,,
"Importing taxa lists or data processed externally (detections, predictions, data from private HPC, list of public HTTP URLs).",Francis  Michael meeting notes,28,,,,,,,,,,,,Feature/Import,,,,,,,,"Importing taxa lists or data processed externally (detections, predictions, data from private HPC, list of public HTTP URLs).",Antenna gaps - big picture,,,,,
"Misc. UI gaps: More obvious interlinking between occurrence detail and session detail, Consistent saving behavior, Hovering toolbar in session detail, Regex null bug.",Francis  Michael meeting notes,29,,,,,,,,,,,,Bug/Feature/UI,,,,,,,,"Misc. UI gaps: More obvious interlinking between occurrence detail and session detail, Consistent saving behavior, Hovering toolbar in session detail, Regex null bug.",Antenna gaps - big picture,,,,,
Add alerts for species on user watch lists.,Francis  Michael meeting notes,30,,,,,,,,,,,,Feature/UI,,,,,,,,Add alerts for species on user watch lists.,2025 RPP Application (2026 Expected Outcomes),,,,,
Implement enhanced post-processing techniques (moths & insects specific) to improve accuracy.,Francis  Michael meeting notes,31,,,,,,,,,,,,Feature/ML,,,,,,,,Implement enhanced post-processing techniques (moths & insects specific) to improve accuracy.,2025 RPP Application (2026 Expected Outcomes),,,,,
"Transition to automated and centralized instance management (Terraform/Ansible for VMs, Docker Swarm for services).",Francis  Michael meeting notes,32,,,,,,,,,,,,Infrastructure/Tech Debt,,,,,,,,"Transition to automated and centralized instance management (Terraform/Ansible for VMs, Docker Swarm for services).",2025 RPP Application (2026 Expected Outcomes),,,,,
"Research focus on uncertainty metrics and adding UI/UX features to help users interpret predictions (e.g., trustworthy results for summaries/notifications).",Francis  Michael meeting notes,33,,,,,,,,,,,,Feature/ML/UI,,,,,,,,"Research focus on uncertainty metrics and adding UI/UX features to help users interpret predictions (e.g., trustworthy results for summaries/notifications).",2025 RPP Application (2027 Expected Outcomes),,,,,
Add general notifications.,Francis  Michael meeting notes,34,,,,,,,,,,,,Feature/UI,,,,,,,,Add general notifications.,2025 RPP Application (2027 Expected Outcomes),,,,,
Explore Kubernetes if limited by Docker Swarm.,Francis  Michael meeting notes,35,,,,,,,,,,,,Infrastructure/Tech Debt,,,,,,,,Explore Kubernetes if limited by Docker Swarm.,2025 RPP Application (2027 Expected Outcomes),,,,,
Support for web-connected devices (continuous upload & processing).,Francis  Michael meeting notes,36,,,,,,,,,,,,Feature/Upload,,,,,,,,Support for web-connected devices (continuous upload & processing).,2025 RPP Application (2028 Expected Outcomes),,,,,
Test semi-automated training (active learning) of models.,Francis  Michael meeting notes,37,,,,,,,,,,,,Feature/ML,,,,,,,,Test semi-automated training (active learning) of models.,2025 RPP Application (Resource Request Justification),,,,,
"Add missing fields related to images when exporting (source image, height, width, etc.) to CSV.",Francis  Michael meeting notes,38,,,,,,,,,,,,Feature/Export,,,,,,,,"Add missing fields related to images when exporting (source image, height, width, etc.) to CSV.",Antenna alignment monthly meeting (Aarhus),,,,,
Ability to flag species outside classifier taxonomy (needs user stories).,Francis  Michael meeting notes,39,,,,,,,,,,,,Idea/Feature,,,,,,,,Ability to flag species outside classifier taxonomy (needs user stories).,Antenna alignment monthly meeting (Aarhus),,,,,
Restrict to species list (Class masking).,Francis  Michael meeting notes,40,,,,,,,,,,,,Feature/ML,,,,,,,,Restrict to species list (Class masking).,Antenna alignment monthly meeting (Aarhus),,,,,
Download X amount of photos for a species list with high confidence (Add new export format/filter).,Francis  Michael meeting notes,41,,,,,,,,,,,,Feature/Export/Filter,,,,,,,,Download X amount of photos for a species list with high confidence (Add new export format/filter).,Antenna alignment monthly meeting (Aarhus),,,,,
Clustering for labeling (vector search backend) - refactor work done for Panama.,Francis  Michael meeting notes,42,,,,,,,,,,,,Feature/ML/Tech Debt,,,,,,,,Clustering for labeling (vector search backend) - refactor work done for Panama.,Antenna alignment monthly meeting (Aarhus),,,,,
Labeling interface - Bulk labeling from the grid view.,Francis  Michael meeting notes,43,,,,,,,,,,,,Feature/UI/Labeling,,,,,,,,Labeling interface - Bulk labeling from the grid view.,Antenna alignment monthly meeting (Aarhus),,,,,
"Manually edit bounding box annotations for detections (delete, add, modify).",Francis  Michael meeting notes,44,,,,,,,,,,,,Feature/UI/Labeling,,,,,,,,"Manually edit bounding box annotations for detections (delete, add, modify).",Antenna alignment monthly meeting (Aarhus),,,,,
"New export format geared toward ML with previous predictions, corrected IDs (HuggingFace, Kaggle format).",Francis  Michael meeting notes,45,,,,,,,,,,,,Feature/Export/ML Dev,,,,,,,,"New export format geared toward ML with previous predictions, corrected IDs (HuggingFace, Kaggle format).",Antenna alignment monthly meeting (Aarhus),,,,,
Importing already-processed data into Antenna to use data management & collaboration tools.,Francis  Michael meeting notes,46,,,,,,,,,,,,Feature/Import,,,,,,,,Importing already-processed data into Antenna to use data management & collaboration tools.,Antenna alignment monthly meeting (Aarhus),,,,,
Test sets for standard evaluation of models (format and share ami-traps dataset).,Francis  Michael meeting notes,47,,,,,,,,,,,,ML Dev/Process,,,,,,,,Test sets for standard evaluation of models (format and share ami-traps dataset).,Antenna alignment monthly meeting (Aarhus),,,,,
Bug: Sign up as new user requires admin support (currently disabled).,Francis  Michael meeting notes,48,,,,,,,,,,,,Bug/Issue,,,,,,,,Bug: Sign up as new user requires admin support (currently disabled).,Antenna workflow overview & gaps (Line 2),,,,,
Bug: Reset password when not logged in is unstable (backend configuration incomplete).,Francis  Michael meeting notes,49,,,,,,,,,,,,Bug/Issue,,,,,,,,Bug: Reset password when not logged in is unstable (backend configuration incomplete).,Antenna workflow overview & gaps (Line 6),,,,,
Feature Rollout: Create a project from scratch is partially implemented/disabled for most users.,Francis  Michael meeting notes,50,,,,,,,,,,,,Feature/Status,,,,,,,,Feature Rollout: Create a project from scratch is partially implemented/disabled for most users.,Antenna workflow overview & gaps (Line 8),,,,,
Feature: Configure members for a project is partially implemented.,Francis  Michael meeting notes,51,,,,,,,,,,,,Feature/UI/Admin,,,,,,,,Feature: Configure members for a project is partially implemented.,Antenna workflow overview & gaps (Line 11),,,,,
"Needs Documentation: Configure processing services/pipelines for a project, Configure a storage/data source for a station.",Francis  Michael meeting notes,52,,,,,,,,,,,,Documentation,,,,,,,,"Needs Documentation: Configure processing services/pipelines for a project, Configure a storage/data source for a station.","Antenna workflow overview & gaps (Lines 14, 15, 19, 20)",,,,,
Post processing UI,Anna  Michael meeting notes,1,,,,,,,,,,,,Core Features & Improvements,,,,,,,,,,Post processing UI,"Feature area, mentioned multiple times as a goal (e.g., for Aarhus).","Aug 25th, Dec 15th",,
How to trigger post process steps from UI?,Anna  Michael meeting notes,2,,,,,,,,,,,,Core Features & Improvements,,,,,,,,,,How to trigger post process steps from UI?,Part of the Aarhus goals.,Aug 25th,,
Tracking,Anna  Michael meeting notes,3,,,,,,,,,,,,Core Features & Improvements,,,,,,,,,,Tracking,"Tracking in place (on demand, even from Django Admin). Mentioned as a September planning item.","Aug 25th, September Planning",,
Class masking,Anna  Michael meeting notes,4,,,,,,,,,,,,Core Features & Improvements,,,,,,,,,,Class masking,Mentioned as an Aarhus goal.,Aug 25th,,
Rank rollups,Anna  Michael meeting notes,5,,,,,,,,,,,,Core Features & Improvements,,,,,,,,,,Rank rollups,"Mentioned as an Aarhus goal. Kent is working on a list of “cryptic” species to use for this feature (e.g., “Cryptic clade”).","Aug 25th, Nov 17th",,
Exports to DARWIN core,Anna  Michael meeting notes,6,,,,,,,,,,,,Core Features & Improvements,,,,,,,,,,Exports to DARWIN core,Mentioned as an Aarhus goal.,Aug 25th,,
Publishing Zenodo DOI,Anna  Michael meeting notes,7,,,,,,,,,,,,Core Features & Improvements,,,,,,,,,,Publishing Zenodo DOI,Mentioned as an Aarhus goal.,Aug 25th,,
Use the zero-shot model,Anna  Michael meeting notes,8,,,,,,,,,,,,Core Features & Improvements,,,,,,,,,,Use the zero-shot model,"Mentioned as an Aarhus goal. Also related to ""Pipeline config (zero shot models)"" for UI.","Aug 25th, UI improvements",,
Default filters & project settings,Anna  Michael meeting notes,9,,,,,,,,,,,,Core Features & Improvements,,,,,,,,,,Default filters & project settings,Mentioned as an Aarhus goal. Backend requirements include Score threshold filter.,"Aug 25th, September Planning",,
Pipeline config from UI?,Anna  Michael meeting notes,10,,,,,,,,,,,,Core Features & Improvements,,,,,,,,,,Pipeline config from UI?,Mentioned as an Aarhus UI improvement and a September planning item.,"Aug 25th, September Planning",,
New project Wizzard,Anna  Michael meeting notes,11,,,,,,,,,,,,Core Features & Improvements,,,,,,,,,,New project Wizzard,"Idea for a new project flow, including Create from template, Create from images, Choose location, and Draft/Public options.",Aug 5th,,
Quick start project / demo,Anna  Michael meeting notes,12,,,,,,,,,,,,Core Features & Improvements,,,,,,,,,,Quick start project / demo,"A quick start project/demo vs. a dedicated inference page. Milestone: ""On boarding.""","Aug 5th, Aug 18th, September Planning",,
Project Settings & feature flags,Anna  Michael meeting notes,13,,,,,,,,,,,,Core Features & Improvements,,,,,,,,,,Project Settings & feature flags,Seems necessary for quick start & improving results.,Aug 5th,,
Import new species & species images,Anna  Michael meeting notes,14,,,,,,,,,,,,Core Features & Improvements,,,,,,,,,,Import new species & species images,September 2nd action item.,Sept 2nd,,
The ability to see where the problems are happening,Anna  Michael meeting notes,15,,,,,,,,,,,,Core Features & Improvements,,,,,,,,,,The ability to see where the problems are happening,Rather than them being obscured in the final output (related to data management issues).,"Mar 18th, 2025",,
IMAGE THUMBNAILING - Faster scrubbing (mp4s),Anna  Michael meeting notes,16,,,,,,,,,,,,Core Features & Improvements,,,,,,,,,,IMAGE THUMBNAILING - Faster scrubbing (mp4s),Performance improvement.,"Mar 18th, 2025",,
Configure members for a project,Anna  Michael meeting notes,17,,,,,,,,,,,,Core Features & Improvements,,,,,,,,,,Configure members for a project,Partially implemented. Anna and Mohamed are currently working on this.,Table [4],,
Create a project from scratch,Anna  Michael meeting notes,18,,,,,,,,,,,,Core Features & Improvements,,,,,,,,,,Create a project from scratch,"Partially implemented. Currently disabled for most users, but soon enabled for all.",Table [4],,
Citizen Science Version/Features,Anna  Michael meeting notes,19,,,,,,,,,,,,Citizen Science/iNaturalist,,,,,,,,,,Citizen Science Version/Features,Thinking about a version or features different from the version for big government/farms.,Nov 17th,,
Button to publish a single observation to iNaturalist?,Anna  Michael meeting notes,20,,,,,,,,,,,,Citizen Science/iNaturalist,,,,,,,,,,Button to publish a single observation to iNaturalist?,Simple feature idea.,Nov 17th,,
Create a user for each model on iNaturalist?,Anna  Michael meeting notes,21,,,,,,,,,,,,Citizen Science/iNaturalist,,,,,,,,,,Create a user for each model on iNaturalist?,Idea for how identifications should show up in iNat (a comment is likely fine). Requires associating with the user's own iNat account.,Nov 17th,,
More inline help for users,Anna  Michael meeting notes,22,,,,,,,,,,,,UI/UX/Process,,,,,,,,,,More inline help for users,"Adding tool tips, info dialogs, inline text blocks & links to full documentation.",Nov 17th,,
Discussion “Collections” terminology,Anna  Michael meeting notes,23,,,,,,,,,,,,UI/UX/Process,,,,,,,,,,Discussion “Collections” terminology,UX/Terminology discussion point.,Nov 17th,,
Separating workflows per user category,Anna  Michael meeting notes,24,,,,,,,,,,,,UI/UX/Process,,,,,,,,,,Separating workflows per user category,Writing user stories.,Aug 25th,,
Make session detail more clear,Anna  Michael meeting notes,25,,,,,,,,,,,,UI/UX/Process,,,,,,,,,,Make session detail more clear,"UI improvement for the ""results half"" of the platform.",Aug 25th,,
Tags for occurrences,Anna  Michael meeting notes,26,,,,,,,,,,,,UI/UX/Process,,,,,,,,,,Tags for occurrences,"UI improvement for the ""results half"" of the platform.",Aug 25th,,
Showing what has been processed,Anna  Michael meeting notes,27,,,,,,,,,,,,UI/UX/Process,,,,,,,,,,Showing what has been processed,"Overall, and within each context. UI improvement.",Aug 25th,,
More prototypes,Anna  Michael meeting notes,28,,,,,,,,,,,,UI/UX/Process,,,,,,,,,,More prototypes,Anna is doing more UX design and definition of tasks.,Aug 25th,,
Getting user personas and user stories on paper,Anna  Michael meeting notes,29,,,,,,,,,,,,UI/UX/Process,,,,,,,,,,Getting user personas and user stories on paper,Process/UX task.,"Aug 25th, September Planning",,
Need tooltips? Walkthrough dialogs?,Anna  Michael meeting notes,30,,,,,,,,,,,,UI/UX/Process,,,,,,,,,,Need tooltips? Walkthrough dialogs?,UX/Feature question for the new project wizard/onboarding.,Aug 5th,,
Filters vs project settings,Anna  Michael meeting notes,31,,,,,,,,,,,,UI/UX/Process,,,,,,,,,,Filters vs project settings,Design/UX question regarding default project filters.,"Aug 18th, 2025",,
Idea on how to disable filters,Anna  Michael meeting notes,32,,,,,,,,,,,,UI/UX/Process,,,,,,,,,,Idea on how to disable filters,Feature/UX idea for project filters.,"Aug 18th, 2025",,
Missing Singapore classifier option,Anna  Michael meeting notes,33,,,,,,,,,,,,Backend/Technical/Bugs,,,,,,,,,,Missing Singapore classifier option,Issue for Jenna's project. Pull request: RolnickLab/ami-data-companion/pull/72,Dec 15th,,
Still some sessions with unprocessed images,Anna  Michael meeting notes,34,,,,,,,,,,,,Backend/Technical/Bugs,,,,,,,,,,Still some sessions with unprocessed images,Issue for Jamie's project (at 10 minute intervals).,Dec 15th,,
Missing images,Anna  Michael meeting notes,35,,,,,,,,,,,,Backend/Technical/Bugs,,,,,,,,,,Missing images,Issue for Jenna's project—are they in object storage?,Dec 15th,,
Switch background tasks,Anna  Michael meeting notes,36,,,,,,,,,,,,Backend/Technical/Bugs,,,,,,,,,,Switch background tasks,From long running to many short. Backend improvement for September planning.,September Planning,,
Switch from form data to application/json,Anna  Michael meeting notes,37,,,,,,,,,,,,Backend/Technical/Bugs,,,,,,,,,,Switch from form data to application/json,Technical improvement idea related to the default project filters PR.,"Aug 18th, 2025",,
Issue of shared credentials,Anna  Michael meeting notes,38,,,,,,,,,,,,Backend/Technical/Bugs,,,,,,,,,,Issue of shared credentials,Worry about accidental deletion for Marc & Ariane project.,"Aug 5th, 2025",,
cover image fields,Anna  Michael meeting notes,39,,,,,,,,,,,,Backend/Technical/Bugs,,,,,,,,,,cover image fields,Promise to bring over ASAP. Need to cherry pick cover_image_url in the data migration.,"Aug 5th, 2025",,
Reset password when not logged in,Anna  Michael meeting notes,40,,,,,,,,,,,,Backend/Technical/Bugs,,,,,,,,,,Reset password when not logged in,Unstable. Backend configuration is incomplete. Suggestion to disable for now and ask people to write to us.,Table [4],,
Sign up as new user on the platform,Anna  Michael meeting notes,41,,,,,,,,,,,,Backend/Technical/Bugs,,,,,,,,,,Sign up as new user on the platform,Requires admin support. Implemented but currently disabled; users are manually added.,Table [4],,
Data management issues,Anna  Michael meeting notes,42,,,,,,,,,,,,Backend/Technical/Bugs,,,,,,,,,,Data management issues,"Rotated images, missing metadata, images that are just gray (bad data).","Mar 18th, 2025",,
h265 encoding with regional resolution,Anna  Michael meeting notes,43,,,,,,,,,,,,Backend/Technical/Bugs,,,,,,,,,,h265 encoding with regional resolution,Technical idea (run locally on rpi before upload).,"Mar 18th, 2025",,
New home for Antenna docs!,Anna  Michael meeting notes,44,,,,,,,,,,,,Documentation,,,,,,,,,,New home for Antenna docs!,Documentation-related goal.,"Aug 18th, 2025",,
Place for users to add their experience,Anna  Michael meeting notes,45,,,,,,,,,,,,Documentation,,,,,,,,,,Place for users to add their experience,Feature/Idea for documentation.,"Aug 18th, 2025",,
At least one documentation ticket,Anna  Michael meeting notes,46,,,,,,,,,,,,Documentation,,,,,,,,,,At least one documentation ticket,September planning item.,September Planning,,
Configure processing services/pipelines,Anna  Michael meeting notes,47,,,,,,,,,,,,Documentation,,,,,,,,,,Configure processing services/pipelines,Both of these tasks need documentation.,Table [4],,
Configure a storage/data source,Anna  Michael meeting notes,48,,,,,,,,,,,,Documentation,,,,,,,,,,Configure a storage/data source,Both of these tasks need documentation.,Table [4],,
Demonstration for self-installation,Anna  Michael meeting notes,49,,,,,,,,,,,,Documentation,,,,,,,,,,Demonstration for self-installation,For development (Aarhus goal).,Aug 25th,,
RUNNING ANTENNA LOCALLY,Anna  Michael meeting notes,50,,,,,,,,,,,,Documentation,,,,,,,,,,RUNNING ANTENNA LOCALLY,Topic of discussion.,"Mar 18th, 2025",,
UI for Project Managers to invite members and assign roles (Role Management UI),Dev Meeting,1,,,,,,,,,,,,User/Project Management,,,,,,,,,,,,,UI for Project Managers to invite members and assign roles (Role Management UI),"[1], [4] (Planning Topics), Generated Retrospective, Generated Roadmap"
"Self-service features (using feature-flags, complexity as an opt-in)",Dev Meeting,2,,,,,,,,,,,,,,,,,,,,,,,,,"Self-service features (using feature-flags, complexity as an opt-in)","[1], [4] (2026 Planning)"
